{
  "schema_version": "3.0",
  "trace_id": "trace_2026_05_royalty_os_structural_0001",
  "content_os_id": "royalty-os:jp:shidenkai-alpha:intzei-os-v3:trace-layer-001",
  "timestamp": "2026-05-27T10:30:00+09:00",
  "session_id": "session_anonymized_84f2",
  "trace_context": {
    "environment": "research",
    "trace_source": "rag_retrieval_log",
    "jurisdiction": "JP"
  },
  "actor": {
    "ai_model_id": "example-rag-agent-v1",
    "provider_id": "example-provider",
    "deployment_context": "rag",
    "system_role": "generator"
  },
  "retrieval": {
    "retrieval_score": 0.92,
    "retrieval_granularity": "structure",
    "retrieved_fragment_hash": "sha256:7f6a9c2d4e8b1f0a6c3d2e9f4b7a1c8d0e5f6a9b2c3d4e5f6a7b8c9d0e1f2a3b",
    "retrieved_fragment_length": 1840,
    "retrieval_rank": 1,
    "retrieval_method": "hybrid_search"
  },
  "usage": {
    "usage_type": "structural_influence",
    "output_fragment_hash": "sha256:2b8f4c9e1a7d6f3c0b5e8a9d4f1c7b2e6a3d9f8c5b1e4a7d0f6c3b9e2a5d8f1c",
    "output_granularity": "structure",
    "citation_visible_to_user": false,
    "human_visible_use": true
  },
  "permission": {
    "permission_scope": "allow_reference",
    "permission_status": "valid",
    "license_uri": "https://example.org/licenses/royalty-os-reference-v3",
    "permission_evidence_hash": "sha256:5c1e9a7f3b2d8c4e6a0f9b1d7c3e5a8f2b4d6c9e1a3f7b0d5c8e2a6f9b1d4c7e"
  },
  "verification": {
    "watermark_detected": true,
    "c2pa_manifest_detected": true,
    "soft_binding_resolved": true,
    "retrieval_log_confirmed": true,
    "outlier_origin_detected": true,
    "verification_confidence": 0.89,
    "verification_methods": [
      "watermark",
      "c2pa_manifest",
      "soft_binding",
      "retrieval_log",
      "fragment_hash",
      "semantic_similarity",
      "outlier_detection"
    ]
  },
  "attribution": {
    "influence_estimate": 0.76,
    "origin_score": 0.94,
    "attribution_confidence": 0.82,
    "allocation_readiness": "trigger_candidate",
    "attribution_method": "hybrid"
  },
  "privacy": {
    "user_prompt_stored": false,
    "user_identity_stored": false,
    "anonymized_session": true,
    "raw_content_stored": false,
    "privacy_mode": "hash_only"
  },
  "evidence": {
    "evidence_bundle_id": "evidence_bundle_trace_2026_05_0001",
    "evidence_bundle_hash": "sha256:9d4f1c7b2e6a3d9f8c5b1e4a7d0f6c3b9e2a5d8f1c2b8f4c9e1a7d6f3c0b5e8a",
    "manifest_uri": "https://example.org/manifests/royalty-os-trace-layer-001.json",
    "audit_log_uri": "https://example.org/audit/trace_2026_05_royalty_os_structural_0001"
  },
  "notes": "This example represents a structural influence trace event. The AI system did not directly quote the source, but the retrieved work significantly influenced the architecture, classification, or conceptual structure of the generated output."
}
